{
  "$id": "https://lnv-asbuiltdoc.github.io/LNV.AsBuiltDoc.Contracts/tech/Lenovo.XCC/dataset/document-hardware-summary.schema.json",
  "$schema": "https://json-schema.org/draft/2020-12/schema",
  "additionalProperties": true,
  "properties": {
    "collected_at_utc": {
      "type": [
        "string",
        "null"
      ]
    },
    "collector": {
      "type": "object"
    },
    "dataset": {
      "const": "document-hardware-summary"
    },
    "item_count": {
      "minimum": 0,
      "type": "integer"
    },
    "items": {
      "items": {
        "additionalProperties": true,
        "properties": {
          "collectedUtc": {
            "format": "date-time",
            "type": "string"
          },
          "collectionStatus": {
            "enum": [
              "success",
              "partial",
              "failed"
            ],
            "type": "string"
          },
          "cores": {
            "type": [
              "number",
              "null"
            ]
          },
          "disabledDimms": {
            "type": [
              "string",
              "null"
            ]
          },
          "health": {
            "type": [
              "string",
              "null"
            ]
          },
          "hostName": {
            "type": [
              "string",
              "null"
            ]
          },
          "machineType": {
            "type": [
              "string",
              "null"
            ]
          },
          "managerId": {
            "type": [
              "string",
              "null"
            ]
          },
          "memory": {
            "type": [
              "string",
              "null"
            ]
          },
          "model": {
            "type": [
              "string",
              "null"
            ]
          },
          "position": {
            "type": [
              "string",
              "null"
            ]
          },
          "processor": {
            "type": [
              "string",
              "null"
            ]
          },
          "rack": {
            "type": [
              "string",
              "null"
            ]
          },
          "role": {
            "type": [
              "string",
              "null"
            ]
          },
          "row": {
            "type": [
              "string",
              "null"
            ]
          },
          "serialNumber": {
            "type": [
              "string",
              "null"
            ]
          },
          "serverIdentity": {
            "type": [
              "string",
              "null"
            ]
          },
          "site": {
            "type": [
              "string",
              "null"
            ]
          },
          "siteSort": {
            "type": [
              "string",
              "null"
            ]
          },
          "sourceEndpoint": {
            "type": [
              "string",
              "null"
            ]
          },
          "sourcePath": {
            "type": [
              "string",
              "null"
            ]
          },
          "state": {
            "type": [
              "string",
              "null"
            ]
          },
          "storageController": {
            "type": [
              "string",
              "null"
            ]
          },
          "storageSummary": {
            "type": [
              "string",
              "null"
            ]
          },
          "systemId": {
            "type": [
              "string",
              "null"
            ]
          },
          "targetDisplayName": {
            "type": [
              "string",
              "null"
            ]
          },
          "targetKey": {
            "minLength": 1,
            "type": "string"
          },
          "xccAddress": {
            "type": [
              "string",
              "null"
            ]
          }
        },
        "required": [
          "targetKey",
          "collectionStatus",
          "collectedUtc"
        ],
        "type": "object"
      },
      "type": "array"
    },
    "schema_version": {
      "const": "lnv.collector.dataset.v1"
    },
    "source": {
      "type": "object"
    }
  },
  "required": [
    "schema_version",
    "collector",
    "source",
    "dataset",
    "item_count",
    "items"
  ],
  "title": "Lenovo.XCC document-hardware-summary dataset",
  "type": "object"
}
