{
  "schema_version": "lnv.collector.dataset.v1",
  "collector": {
    "tech_id": "Lenovo.XCC",
    "module": "LNV.AsBuiltDoc.Lenovo.XCC",
    "entry_point": "Invoke-AsBuiltDoc.Lenovo.XCC"
  },
  "source": {
    "bundle_id": "0634a81a-4d4d-47f8-9ac6-ad28965741e7",
    "bundle_root": "C:\\Github\\LNV.AsBuiltDoc.Core\\out\\412f44d4-06fa-4b1b-b1ea-bd0d7ac07ed8",
    "target_key": "srv05-xcc",
    "file": "datasets/Lenovo.XCC/core/srv05-xcc/document-hardware-summary.json"
  },
  "dataset": "document-hardware-summary",
  "item_count": 1,
  "items": [
    {
      "targetKey": "srv05-xcc",
      "targetDisplayName": "VXNODE05 XCC",
      "systemId": "1",
      "managerId": null,
      "hostName": "VXNODE05-XCC",
      "serialNumber": "J301DX1P",
      "serverIdentity": "VXNODE05-XCC",
      "machineType": "",
      "model": "ThinkSystem SE350",
      "xccAddress": "https://192.168.183.105",
      "collectionStatus": "success",
      "collectedUtc": "2026-07-02T06:30:59.1626024Z",
      "health": "Critical",
      "state": "Enabled",
      "sourcePath": "/redfish/v1/Systems/1",
      "sourceEndpoint": "/redfish/v1/Systems/1",
      "processor": "Intel(R) Xeon(R) D-2143IT CPU @ 2.20GHz",
      "cores": 8.0,
      "memory": "128 GiB",
      "disabledDimms": "DIMM 2",
      "storageSummary": "2 drive(s) 238 GiB",
      "storageController": "M.2 Storage"
    }
  ]
}
